{
  "$schema": "https://json-schema.org/draft/2020-12/schema",
  "$id": "urn:readable-studio:schema:plugin-manifest:v1",
  "title": "Readable Studio plugin manifest (v1)",
  "description": "Schema for `readable-studio.json` sidecar files. Companion of `SKILL.md`; never duplicates skill body content. See plugins/spec/SPEC.md.",
  "type": "object",
  "required": ["specVersion", "name", "version"],
  "additionalProperties": true,
  "properties": {
    "$schema": { "type": "string", "format": "uri" },
    "specVersion": { "type": "string", "minLength": 1 },
    "name": { "type": "string", "minLength": 1, "pattern": "^[a-z0-9][a-z0-9._-]*$" },
    "title": { "type": "string", "minLength": 1 },
    "title_i18n": { "$ref": "#/$defs/LocalizedText" },
    "version": { "type": "string", "minLength": 1 },
    "description": { "type": "string" },
    "description_i18n": { "$ref": "#/$defs/LocalizedText" },
    "author": {
      "type": "object",
      "properties": {
        "name": { "type": "string" },
        "url":  { "type": "string", "format": "uri" }
      },
      "additionalProperties": true
    },
    "license":  { "type": "string" },
    "homepage": { "type": "string", "format": "uri" },
    "icon":     { "type": "string" },
    "tags":     { "type": "array", "items": { "type": "string" } },
    "compat": {
      "type": "object",
      "properties": {
        "agentSkills":   { "type": "array", "items": { "$ref": "#/$defs/RefPath" } },
        "claudePlugins": { "type": "array", "items": { "$ref": "#/$defs/RefPath" } }
      },
      "additionalProperties": true
    },
    "readable": {
      "type": "object",
      "properties": {
        "kind":     { "type": "string", "enum": ["skill", "scenario", "atom", "bundle"] },
        "taskKind": { "type": "string", "enum": ["new-generation", "code-migration", "figma-migration", "tune-collab"] },
        "hubType":  { "type": "string", "enum": ["deck", "report", "website", "none"], "description": "Single Hub artifact type, independent of generation mode. Explicit none opts out of all template tabs." },
        "mode":     { "type": "string" },
        "platform": { "type": "string" },
        "scenario": { "type": "string" },
        "engineRequirements": {
          "type": "object",
          "properties": { "readable": { "type": "string" } },
          "additionalProperties": true
        },
        "visualReference": {
          "type": "object",
          "description": "Content-clean presentation characteristics for additive visual-reference selection. Must exclude the example's brand, subject, copy, data, and asset identities.",
          "required": ["characteristics"],
          "properties": {
            "characteristics": {
              "type": "array",
              "minItems": 1,
              "items": { "type": "string", "minLength": 1 }
            }
          },
          "additionalProperties": true
        },
        "preview": {
          "type": "object",
          "properties": {
            "type":   { "type": "string" },
            "entry":  { "type": "string" },
            "poster": { "type": "string" },
            "video":  { "type": "string" },
            "gif":    { "type": "string" },
            "motion": {
              "type": "string",
              "enum": ["scroll", "deck", "static"],
              "description": "How the gallery should capture this HTML preview's hover clip: 'scroll' = vertical-scroll landing page (pan top->bottom), 'deck' = horizontal slideshow (walk slides), 'static' = single fixed screen (hold its in-place animation). Omit to auto-detect from the page's scroll height."
            }
          },
          "additionalProperties": true
        },
        "useCase": {
          "type": "object",
          "properties": {
            "query": {
              "oneOf": [
                { "type": "string" },
                { "$ref": "#/$defs/LocalizedText" }
              ]
            },
            "exampleOutputs": {
              "type": "array",
              "items": {
                "type": "object",
                "required": ["path"],
                "properties": {
                  "path":  { "type": "string" },
                  "title": { "type": "string" }
                },
                "additionalProperties": true
              }
            }
          },
          "additionalProperties": true
        },
        "context": {
          "type": "object",
          "properties": {
            "skills":        { "type": "array", "items": { "$ref": "#/$defs/Reference" } },
            "designSystem":  {
              "oneOf": [
                { "$ref": "#/$defs/Reference" },
                { "type": "object", "properties": { "ref": { "type": "string" }, "primary": { "type": "boolean" } }, "additionalProperties": true }
              ]
            },
            "craft":         { "type": "array", "items": { "type": "string" } },
            "assets":        { "type": "array", "items": { "type": "string" } },
            "claudePlugins": { "type": "array", "items": { "$ref": "#/$defs/Reference" } },
            "mcp":           { "type": "array", "items": { "$ref": "#/$defs/McpServerSpec" } },
            "atoms":         { "type": "array", "items": { "type": "string" } }
          },
          "additionalProperties": true
        },
        "pipeline": {
          "type": "object",
          "required": ["stages"],
          "properties": {
            "stages": {
              "type": "array",
              "items": {
                "type": "object",
                "required": ["id", "atoms"],
                "properties": {
                  "id":        { "type": "string", "minLength": 1 },
                  "atoms":     { "type": "array", "items": { "type": "string" } },
                  "repeat":    { "type": "boolean" },
                  "until":     { "type": "string" },
                  "onFailure": { "type": "string", "enum": ["abort", "skip", "retry"] }
                },
                "additionalProperties": true
              }
            }
          },
          "additionalProperties": true
        },
        "genui": {
          "type": "object",
          "properties": {
            "surfaces": {
              "type": "array",
              "items": { "$ref": "#/$defs/GenUISurface" }
            }
          },
          "additionalProperties": true
        },
        "inputs": {
          "type": "array",
          "items": { "$ref": "#/$defs/InputField" }
        },
        "capabilities": { "type": "array", "items": { "type": "string" } }
      },
      "additionalProperties": true
    }
  },
  "$defs": {
    "RefPath": {
      "type": "object",
      "required": ["path"],
      "properties": { "path": { "type": "string", "minLength": 1 } },
      "additionalProperties": true
    },
    "LocalizedText": {
      "type": "object",
      "minProperties": 1,
      "additionalProperties": { "type": "string" }
    },
    "Reference": {
      "type": "object",
      "properties": {
        "ref":  { "type": "string" },
        "path": { "type": "string" }
      },
      "additionalProperties": true
    },
    "McpServerSpec": {
      "type": "object",
      "required": ["name"],
      "properties": {
        "name":    { "type": "string" },
        "command": { "type": "string" },
        "args":    { "type": "array", "items": { "type": "string" } },
        "env":     { "type": "object", "additionalProperties": { "type": "string" } },
        "url":     { "type": "string" }
      },
      "additionalProperties": true
    },
    "GenUISurface": {
      "type": "object",
      "required": ["id", "kind", "persist"],
      "properties": {
        "id":      { "type": "string", "minLength": 1 },
        "kind":    { "type": "string", "enum": ["form", "choice", "confirmation", "oauth-prompt"] },
        "persist": { "type": "string", "enum": ["run", "conversation", "project"] },
        "trigger": {
          "type": "object",
          "properties": {
            "stageId": { "type": "string" },
            "atom":    { "type": "string" }
          },
          "additionalProperties": true
        },
        "schema":               { "type": "object" },
        "prompt":               { "type": "string" },
        "capabilitiesRequired": { "type": "array", "items": { "type": "string" } },
        "timeout":              { "type": "integer", "minimum": 1 },
        "onTimeout":            { "type": "string", "enum": ["abort", "default", "skip"] },
        "default":              {},
        "oauth": {
          "type": "object",
          "required": ["route"],
          "properties": {
            "route":       { "type": "string", "enum": ["mcp", "plugin"] },
            "mcpServerId": { "type": "string" }
          },
          "additionalProperties": true
        }
      },
      "additionalProperties": true
    },
    "InputField": {
      "type": "object",
      "required": ["name"],
      "properties": {
        "name":        { "type": "string", "minLength": 1 },
        "label":       { "type": "string" },
        "type":        { "type": "string", "enum": ["string", "text", "select", "number", "boolean", "file"] },
        "required":    { "type": "boolean" },
        "options":     { "type": "array", "items": { "type": "string" } },
        "placeholder": { "type": "string" },
        "default":     {}
      },
      "additionalProperties": true
    }
  }
}
