{
  "$schema": "urn:readable-studio:schema:plugin-manifest:v1",
  "specVersion": "1.0.0",
  "name": "example-gamified-app",
  "title": "Gamified App",
  "title_i18n": {
    "zh-CN": "游戏化应用",
    "zh-TW": "遊戲化應用程式",
    "ja": "ゲーミフィケーションアプリ",
    "ko": "게임화 앱",
    "de": "Gamifizierte App",
    "fr": "Application gamifiée",
    "ru": "Игровое приложение",
    "es": "Aplicación gamificada",
    "pt-BR": "App gamificado",
    "it": "App gamificata",
    "vi": "Ứng dụng trò chơi hóa",
    "pl": "Aplikacja grywalizowana",
    "id": "Aplikasi gamifikasi",
    "nl": "Gamified app",
    "ar": "تطبيق مُلَعَّب",
    "tr": "Oyunlaştırılmış uygulama",
    "uk": "Ігровий додаток",
    "en": "Gamified App"
  },
  "version": "0.1.0",
  "description": "A multi-frame gamified mobile-app prototype — three phone frames on a dark\nshowcase stage. Frame 1: cover / poster, Frame 2: today's quests with XP\nribbons and a level bar, Frame 3: quest detail. Vivid quest tiles, level\nribbon, bottom tab bar. Use when the brief asks for a \"gamified app\",\n\"habit tracker\", \"RPG-style life app\", \"level-up app\", \"daily quests\",\n\"XP / streak app\", or \"ELI5-style explainer app\".",
  "description_i18n": {
    "zh-CN": "三屏手机原型展示游戏化应用界面：封面海报、每日任务与经验值进度条、任务详情。适用于游戏化应用、习惯追踪、RPG 风格生活应用、升级系统、每日任务、XP/连击应用等需求。",
    "zh-TW": "三屏手機原型展示遊戲化應用介面：封面海報、每日任務與經驗值進度條、任務詳情。適用於遊戲化應用、習慣追蹤、RPG 風格生活應用、升級系統、每日任務、XP/連擊應用等需求。",
    "ja": "3画面のゲーミフィケーションアプリプロトタイプ：カバー画面、XPリボンとレベルバー付き今日のクエスト、クエスト詳細。ゲーミフィケーションアプリ、習慣トラッカー、RPG風ライフアプリ、レベルアップアプリ、デイリークエスト、XP/連続記録アプリに最適。",
    "ko": "3개 화면으로 구성된 게임화 모바일 앱 프로토타입: 커버 화면, XP 리본과 레벨 바가 있는 오늘의 퀘스트, 퀘스트 상세 화면. 게임화 앱, 습관 트래커, RPG 스타일 라이프 앱, 레벨업 앱, 일일 퀘스트, XP/연속 기록 앱에 적합합니다.",
    "de": "Drei-Screen-Prototyp einer gamifizierten Mobile-App: Cover-Screen, heutige Quests mit XP-Ribbons und Level-Leiste, Quest-Details. Geeignet für gamifizierte Apps, Habit-Tracker, RPG-Life-Apps, Level-up-Apps, Daily Quests und XP/Streak-Apps.",
    "fr": "Prototype d'application mobile gamifiée en trois écrans : écran de couverture, quêtes du jour avec rubans XP et barre de niveau, détails de quête. Idéal pour les applications gamifiées, suivi d'habitudes, applications de vie RPG, applications de montée de niveau, quêtes quotidiennes et applications XP/streak.",
    "ru": "Трёхэкранный прототип игрового мобильного приложения: обложка, ежедневные квесты с XP-лентами и полосой уровня, детали квеста. Подходит для игровых приложений, трекеров привычек, RPG-приложений для жизни, приложений с прокачкой, ежедневными квестами и системой XP/стриков.",
    "es": "Prototipo de aplicación móvil gamificada de tres pantallas: portada, misiones diarias con cintas de XP y barra de nivel, detalle de misión. Ideal para aplicaciones gamificadas, rastreadores de hábitos, aplicaciones de vida RPG, aplicaciones de subida de nivel, misiones diarias y aplicaciones de XP/rachas.",
    "pt-BR": "Protótipo de aplicativo móvel gamificado em três telas: capa, missões diárias com fitas de XP e barra de nível, detalhes da missão. Ideal para aplicativos gamificados, rastreadores de hábitos, aplicativos de vida RPG, aplicativos de level-up, missões diárias e aplicativos de XP/sequências.",
    "it": "Prototipo di app mobile gamificata su tre schermate: copertina, quest giornaliere con nastri XP e barra livello, dettagli quest. Ideale per app gamificate, tracker di abitudini, app life RPG, app level-up, quest giornaliere e app XP/streak.",
    "vi": "Nguyên mẫu ứng dụng di động trò chơi hóa ba màn hình: màn bìa, nhiệm vụ hôm nay với ruy-băng XP và thanh cấp độ, chi tiết nhiệm vụ. Phù hợp cho ứng dụng trò chơi hóa, theo dõi thói quen, ứng dụng cuộc sống RPG, ứng dụng nâng cấp, nhiệm vụ hàng ngày và ứng dụng XP/chuỗi.",
    "pl": "Prototyp grywalizowanej aplikacji mobilnej na trzech ekranach: okładka, dzisiejsze questy z wstążkami XP i paskiem poziomu, szczegóły questa. Idealny do aplikacji grywalizowanych, trackerów nawyków, aplikacji życiowych RPG, aplikacji levelowania, daily questów i aplikacji XP/streak.",
    "id": "Prototipe aplikasi seluler gamifikasi tiga layar: sampul, quest hari ini dengan pita XP dan bilah level, detail quest. Cocok untuk aplikasi gamifikasi, pelacak kebiasaan, aplikasi kehidupan RPG, aplikasi level-up, quest harian, dan aplikasi XP/streak.",
    "nl": "Drieframe prototype van een gamified mobiele app: cover, dagelijkse quests met XP-linten en level-balk, questdetails. Geschikt voor gamified apps, habit trackers, RPG-stijl levensapps, level-up apps, dagelijkse quests en XP/streak-apps.",
    "ar": "نموذج تطبيق جوال مُلَعَّب من ثلاث شاشات: الغلاف، مهام اليوم مع أشرطة XP وشريط المستوى، تفاصيل المهمة. مناسب لتطبيقات اللعب، متتبعات العادات، تطبيقات الحياة بأسلوب RPG، تطبيقات الترقية، المهام اليومية وتطبيقات XP/السلاسل.",
    "tr": "Üç ekranlı oyunlaştırılmış mobil uygulama prototipi: kapak, XP şeritleri ve seviye çubuğu ile günlük görevler, görev detayı. Oyunlaştırılmış uygulamalar, alışkanlık takipçileri, RPG tarzı yaşam uygulamaları, seviye atlama uygulamaları, günlük görevler ve XP/seri uygulamaları için idealdir.",
    "uk": "Триекранний прототип ігрового мобільного додатка: обкладинка, щоденні квести зі стрічками XP та шкалою рівня, деталі квесту. Підходить для ігрових додатків, трекерів звичок, RPG-додатків для життя, додатків з прокачкою, щоденними квестами та системою XP/стріків.",
    "en": "A multi-frame gamified mobile-app prototype — three phone frames on a dark\nshowcase stage. Frame 1: cover / poster, Frame 2: today's quests with XP\nribbons and a level bar, Frame 3: quest detail. Vivid quest tiles, level\nribbon, bottom tab bar. Use when the brief asks for a \"gamified app\",\n\"habit tracker\", \"RPG-style life app\", \"level-up app\", \"daily quests\",\n\"XP / streak app\", or \"ELI5-style explainer app\"."
  },
  "license": "MIT",
  "author": {
    "name": "Readable Studio",
    "url": "https://github.com/sanghyunna/readable-studio"
  },
  "homepage": "https://github.com/sanghyunna/readable-studio/tree/main/plugins/_official/examples/gamified-app",
  "tags": [
    "example",
    "first-party",
    "prototype",
    "personal",
    "web",
    "mobile",
    "gamified-app",
    "habit-tracker",
    "rpg-app",
    "level-up-app",
    "daily-quests",
    "xp-app",
    "streak-app",
    "life-management-app",
    "untitled"
  ],
  "compat": {
    "agentSkills": [
      {
        "path": "./SKILL.md"
      }
    ]
  },
  "readable": {
    "hubType": "website",
    "thumbnail": {"src":"/template-thumbnails/example-gamified-app.webp"},
    "kind": "scenario",
    "taskKind": "new-generation",
    "mode": "prototype",
    "platform": "mobile",
    "scenario": "personal",
    "surface": "web",
    "preview": {
      "type": "html",
      "entry": "./example.html"
    },
    "useCase": {
      "query": {
        "en": "Design a gamified life-management app — multi-screen mobile prototype: cover poster, today's quests with XP, and a quest detail. ‘Daily quests for becoming a better human.’",
        "zh-CN": "使用这个插件完成以下任务：Design a gamified life-management app — multi-screen mobile prototype: cover poster, today's quests with XP, and a quest detail. ‘Daily quests for becoming a better human.’"
      },
      "exampleOutputs": [
        {
          "path": "./example.html",
          "title": "Gamified App"
        }
      ]
    },
    "context": {
      "skills": [
        {
          "path": "./SKILL.md"
        }
      ],
      "designSystem": {
        "primary": true
      },
      "craft": [
        "state-coverage",
        "animation-discipline"
      ],
      "assets": [
        "./example.html"
      ]
    },
    "pipeline": {
      "stages": [
        {
          "id": "generate",
          "atoms": [
            "file-write"
          ]
        }
      ]
    },
    "capabilities": [
      "prompt:inject",
      "fs:write"
    ]
  }
}
