{
  "$schema": "urn:readable-studio:schema:plugin-manifest:v1",
  "specVersion": "1.0.0",
  "name": "example-html-ppt-zhangzara-sakura-chroma",
  "title": "Sakura Chroma Cassette Deck",
  "title_i18n": {
    "zh-CN": "Sakura Chroma Cassette Deck",
    "zh-TW": "Sakura Chroma Cassette Deck",
    "ja": "Sakura Chroma Cassette Deck",
    "ko": "사쿠라 크로마 카세트 덱",
    "de": "Sakura Chroma Cassette Deck",
    "fr": "Sakura Chroma Cassette Deck",
    "ru": "Sakura Chroma Cassette Deck",
    "es": "Sakura Chroma Cassette Deck",
    "pt-BR": "Sakura Chroma Cassette Deck",
    "it": "Sakura Chroma Cassette Deck",
    "vi": "Sakura Chroma Cassette Deck",
    "pl": "Sakura Chroma Cassette Deck",
    "id": "Sakura Chroma Cassette Deck",
    "nl": "Sakura Chroma Cassette Deck",
    "ar": "Sakura Chroma Cassette Deck",
    "tr": "Sakura Chroma Cassette Deck",
    "uk": "Sakura Chroma Cassette Deck",
    "en": "Sakura Chroma Cassette Deck"
  },
  "version": "0.1.0",
  "description": "Sakura Chroma — Vintage Japanese cassette-package aesthetic: cream paper, diagonal rainbow ribbons, condensed bold type, JIS-style spec checkboxes. Anything that should feel like a vintage Japanese cassette package or a TDK / Sony / Sakura Color product catalogue: indie hardware brand decks, music-label release schedules, analog studio retrospectives, zine and magazine pitches, kawaii-tech product launches, creative-studio annual reports.",
  "description_i18n": {
    "zh-CN": "Sakura Chroma — 复古日式磁带包装美学风格，包含米色纸张、对角彩虹条纹、粗体压缩字体和 JIS 规格复选框。适用于独立硬件品牌演示、音乐厂牌发行计划、模拟录音室回顾、杂志提案、可爱科技产品发布和创意工作室年报。",
    "zh-TW": "Sakura Chroma — 復古日式卡帶包裝美學風格，包含米色紙張、對角彩虹絲帶、粗體壓縮字體和 JIS 規格核取方塊。適用於獨立硬體品牌簡報、音樂廠牌發行計畫、類比錄音室回顧、雜誌提案、可愛科技產品發表和創意工作室年度報告。",
    "ja": "Sakura Chroma — ヴィンテージ日本カセットパッケージの美学：クリーム色の紙、斜めのレインボーリボン、コンデンス太字、JIS規格チェックボックス。インディーハードウェアブランドデッキ、音楽レーベルリリーススケジュール、アナログスタジオ回顧録、雑誌企画、カワイイテック製品発表、クリエイティブスタジオ年次報告に最適。",
    "ko": "Sakura Chroma — 빈티지 일본 카세트 패키지 미학: 크림색 종이, 대각선 무지개 리본, 압축 볼드체, JIS 스타일 체크박스. 인디 하드웨어 브랜드 덱, 음악 레이블 발매 일정, 아날로그 스튜디오 회고, 잡지 기획, 카와이 테크 제품 출시, 크리에이티브 스튜디오 연례 보고서에 적합.",
    "de": "Sakura Chroma — Vintage-Japanische Kassettenverpackungsästhetik: cremefarbenes Papier, diagonale Regenbogenbänder, kondensierte Fettschrift, JIS-Stil-Checkboxen. Perfekt für Indie-Hardware-Brand-Decks, Musik-Label-Veröffentlichungspläne, Analog-Studio-Retrospektiven, Magazin-Pitches, Kawaii-Tech-Produktlaunches und Kreativstudio-Jahresberichte.",
    "fr": "Sakura Chroma — Esthétique vintage de cassette japonaise : papier crème, rubans arc-en-ciel diagonaux, typographie condensée grasse, cases à cocher style JIS. Idéal pour les présentations de marques hardware indépendantes, calendriers de sorties musicales, rétrospectives de studios analogiques, pitchs de magazines, lancements de produits kawaii-tech et rapports annuels de studios créatifs.",
    "ru": "Sakura Chroma — Винтажная японская эстетика кассетных упаковок: кремовая бумага, диагональные радужные ленты, сжатый жирный шрифт, чекбоксы в стиле JIS. Подходит для презентаций инди-брендов, релиз-графиков музыкальных лейблов, ретроспектив аналоговых студий, журнальных питчей, запусков kawaii-tech продуктов и годовых отчётов креативных студий.",
    "es": "Sakura Chroma — Estética vintage de paquetes de cassette japoneses: papel crema, cintas de arcoíris diagonales, tipografía condensada en negrita, casillas estilo JIS. Ideal para presentaciones de marcas hardware independientes, calendarios de lanzamientos musicales, retrospectivas de estudios analógicos, propuestas de revistas, lanzamientos de productos kawaii-tech e informes anuales de estudios creativos.",
    "pt-BR": "Sakura Chroma — Estética vintage de embalagem de fita cassete japonesa: papel creme, fitas de arco-íris diagonais, tipografia condensada em negrito, checkboxes estilo JIS. Ideal para apresentações de marcas de hardware indie, cronogramas de lançamentos musicais, retrospectivas de estúdios analógicos, propostas de revistas, lançamentos de produtos kawaii-tech e relatórios anuais de estúdios criativos.",
    "it": "Sakura Chroma — Estetica vintage di confezioni di cassette giapponesi: carta color crema, nastri arcobaleno diagonali, caratteri condensati grassetto, checkbox stile JIS. Perfetto per presentazioni di brand hardware indie, calendari di uscite musicali, retrospettive di studi analogici, proposte di riviste, lanci di prodotti kawaii-tech e relazioni annuali di studi creativi.",
    "vi": "Sakura Chroma — Thẩm mỹ bao bì băng cassette Nhật Bản cổ điển: giấy màu kem, dải ruy băng cầu vồng chéo, chữ in đậm thu hẹp, hộp kiểm kiểu JIS. Phù hợp cho bản trình bày thương hiệu phần cứng độc lập, lịch phát hành nhãn nhạc, hồi tưởng studio analog, đề xuất tạp chí, ra mắt sản phẩm kawaii-tech và báo cáo thường niên studio sáng tạo.",
    "pl": "Sakura Chroma — Vintage'owa estetyka japońskich opakowań kaset: kremowy papier, ukośne tęczowe wstążki, skondensowany pogrubiony krój pisma, checkboxy w stylu JIS. Idealne do prezentacji niezależnych marek hardware, harmonogramów wydawnictw muzycznych, retrospektyw analogowych studiów, propozycji magazynowych, premier produktów kawaii-tech i raportów rocznych studiów kreatywnych.",
    "id": "Sakura Chroma — Estetika kemasan kaset Jepang vintage: kertas krem, pita pelangi diagonal, tipografi tebal terkondensasi, kotak centang gaya JIS. Cocok untuk presentasi merek hardware indie, jadwal rilis label musik, retrospektif studio analog, proposal majalah, peluncuran produk kawaii-tech, dan laporan tahunan studio kreatif.",
    "nl": "Sakura Chroma — Vintage Japanse cassetteverpakkingsesthetiek: crèmekleurig papier, diagonale regenbooglinten, gecondenseerd vetgedrukt lettertype, JIS-stijl checkboxen. Perfect voor indie hardware-merkpresentaties, muziek-labelreleaseschema's, analoge studio-retrospectives, tijdschriftpitches, kawaii-tech productlanceringen en creatieve studio-jaarverslagen.",
    "ar": "Sakura Chroma — جماليات عبوات الكاسيت اليابانية القديمة: ورق كريمي، أشرطة قوس قزح قطرية، خط غامق مكثف، مربعات اختيار بأسلوب JIS. مثالي لعروض العلامات التجارية للأجهزة المستقلة، جداول إصدارات شركات الموسيقى، استعراضات الاستوديوهات التناظرية، عروض المجلات، إطلاق منتجات kawaii-tech والتقارير السنوية للاستوديوهات الإبداعية.",
    "tr": "Sakura Chroma — Vintage Japon kaset paketi estetiği: krem kağıt, çapraz gökkuşağı şeritler, sıkıştırılmış kalın yazı tipi, JIS tarzı onay kutuları. Bağımsız donanım markası sunumları, müzik şirketi yayın takvimleri, analog stüdyo retrospektifleri, dergi sunumları, kawaii-tech ürün lansmanları ve yaratıcı stüdyo yıllık raporları için idealdir.",
    "uk": "Sakura Chroma — Вінтажна японська естетика касетних упаковок: кремовий папір, діагональні райдужні стрічки, стиснутий жирний шрифт, чекбокси в стилі JIS. Підходить для презентацій інді-брендів обладнання, графіків релізів музичних лейблів, ретроспектив аналогових студій, журнальних пітчів, запусків kawaii-tech продуктів та річних звітів креативних студій.",
    "en": "Sakura Chroma — Vintage Japanese cassette-package aesthetic: cream paper, diagonal rainbow ribbons, condensed bold type, JIS-style spec checkboxes. Anything that should feel like a vintage Japanese cassette package or a TDK / Sony / Sakura Color product catalogue: indie hardware brand decks, music-label release schedules, analog studio retrospectives, zine and magazine pitches, kawaii-tech product launches, creative-studio annual reports."
  },
  "license": "MIT",
  "author": {
    "name": "Readable Studio",
    "url": "https://github.com/sanghyunna/readable-studio"
  },
  "homepage": "https://github.com/sanghyunna/readable-studio/tree/main/plugins/_official/examples/html-ppt-zhangzara-sakura-chroma",
  "tags": [
    "example",
    "first-party",
    "deck",
    "marketing",
    "web",
    "sakura-chroma",
    "zhangzara-sakura-chroma",
    "retro",
    "playful",
    "confident",
    "product-launch-or-catalogue",
    "indie-hardware-or-analog-studio-brand",
    "html-deck",
    "html-slides",
    "zhangzara"
  ],
  "compat": {
    "agentSkills": [
      {
        "path": "./SKILL.md"
      }
    ]
  },
  "readable": {
    "hubType": "deck",
    "thumbnail": {"src":"/template-thumbnails/example-html-ppt-zhangzara-sakura-chroma.webp"},
    "kind": "scenario",
    "taskKind": "new-generation",
    "mode": "deck",
    "scenario": "marketing",
    "surface": "web",
    "preview": {
      "type": "html",
      "entry": "./example.html"
    },
    "useCase": {
      "query": {
        "en": "Sakura Chroma — Vintage Japanese cassette-package aesthetic: cream paper, diagonal rainbow ribbons, condensed bold type, JIS-style spec checkboxes. Anything that should feel like a vintage Japanese cassette package or a TDK / Sony / Sakura Color product catalogue: indie hardware brand decks, music-label release schedul",
        "zh-CN": "使用这个插件完成以下任务：Sakura Chroma — Vintage Japanese cassette-package aesthetic: cream paper, diagonal rainbow ribbons, condensed bold type, JIS-style spec checkboxes. Anything that should feel like a vintage Japanese cassette package or a TDK / Sony / Sakura Color product catalogue: indie hardware brand decks, music-label release schedul"
      },
      "exampleOutputs": [
        {
          "path": "./example.html",
          "title": "Html Ppt Zhangzara Sakura Chroma"
        }
      ]
    },
    "context": {
      "skills": [
        {
          "path": "./SKILL.md"
        }
      ],
      "assets": [
        "./example.html"
      ]
    },
    "pipeline": {
      "stages": [
        {
          "id": "generate",
          "atoms": [
            "file-write"
          ]
        }
      ]
    },
    "capabilities": [
      "prompt:inject",
      "fs:write"
    ]
  }
}
