{
  "$schema": "urn:readable-studio:schema:plugin-manifest:v1",
  "specVersion": "1.0.0",
  "name": "example-design-brief",
  "title": "Design Brief",
  "title_i18n": {
    "zh-CN": "设计简报",
    "zh-TW": "設計簡報",
    "ja": "デザインブリーフ",
    "ko": "디자인 브리프",
    "de": "Design Brief",
    "fr": "Brief de conception",
    "ru": "Дизайн-бриф",
    "es": "Brief de diseño",
    "pt-BR": "Brief de design",
    "it": "Brief di design",
    "vi": "Bản tóm tắt thiết kế",
    "pl": "Brief projektowy",
    "id": "Brief Desain",
    "nl": "Ontwerpbrief",
    "ar": "موجز التصميم",
    "tr": "Tasarım Brifingi",
    "uk": "Дизайн-бриф",
    "en": "Design Brief"
  },
  "version": "0.1.0",
  "description": "Parse a structured design brief written in I-Lang protocol format into a\nconcrete design spec. Eliminates ambiguity from vague requests like\n\"make it professional\" by requiring explicit dimensions: palette, typography,\nlayout, mood, density, and constraints.\nTrigger keywords: \"design brief\", \"create a design brief\", \"ilang brief\", \"structured brief\".",
  "description_i18n": {
    "zh-CN": "将 I-Lang 协议格式编写的结构化设计简报解析为具体的设计规范。通过要求明确的维度（调色板、排版、布局、氛围、密度和约束）消除诸如'使其专业'之类模糊请求的歧义。\n触发关键词：design brief、create a design brief、ilang brief、structured brief。",
    "zh-TW": "將 I-Lang 協定格式編寫的結構化設計簡報解析為具體的設計規範。透過要求明確的維度（調色盤、排版、佈局、氛圍、密度和約束）消除諸如『使其專業』之類模糊請求的歧義。\n觸發關鍵字：design brief、create a design brief、ilang brief、structured brief。",
    "ja": "I-Lang プロトコル形式で記述された構造化デザインブリーフを具体的なデザイン仕様に解析します。パレット、タイポグラフィ、レイアウト、ムード、密度、制約などの明示的なディメンションを要求することで、『プロフェッショナルにして』のような曖昧なリクエストの不明確さを排除します。\nトリガーキーワード：design brief、create a design brief、ilang brief、structured brief。",
    "ko": "I-Lang 프로토콜 형식으로 작성된 구조화된 디자인 브리프를 구체적인 디자인 사양으로 파싱합니다. 팔레트, 타이포그래피, 레이아웃, 무드, 밀도 및 제약 조건과 같은 명시적 차원을 요구하여 '전문적으로 만들어주세요'와 같은 모호한 요청의 애매함을 제거합니다.\n트리거 키워드: design brief, create a design brief, ilang brief, structured brief.",
    "de": "Parst ein strukturiertes Design-Brief im I-Lang-Protokollformat in eine konkrete Designspezifikation. Eliminiert Mehrdeutigkeit aus vagen Anfragen wie 'mach es professionell', indem explizite Dimensionen erforderlich sind: Palette, Typografie, Layout, Stimmung, Dichte und Einschränkungen.\nTrigger-Schlüsselwörter: design brief, create a design brief, ilang brief, structured brief.",
    "fr": "Analyse un brief de conception structuré au format protocole I-Lang en spécification de conception concrète. Élimine l'ambiguïté des demandes vagues comme 'rends-le professionnel' en exigeant des dimensions explicites : palette, typographie, mise en page, ambiance, densité et contraintes.\nMots-clés de déclenchement : design brief, create a design brief, ilang brief, structured brief.",
    "ru": "Парсит структурированный дизайн-бриф в формате протокола I-Lang в конкретную дизайн-спецификацию. Устраняет неоднозначность расплывчатых запросов вроде 'сделай профессионально', требуя явных параметров: палитра, типографика, макет, настроение, плотность и ограничения.\nКлючевые слова: design brief, create a design brief, ilang brief, structured brief.",
    "es": "Analiza un brief de diseño estructurado en formato de protocolo I-Lang en una especificación de diseño concreta. Elimina la ambigüedad de solicitudes vagas como 'hazlo profesional' al requerir dimensiones explícitas: paleta, tipografía, diseño, ambiente, densidad y restricciones.\nPalabras clave de activación: design brief, create a design brief, ilang brief, structured brief.",
    "pt-BR": "Analisa um brief de design estruturado no formato do protocolo I-Lang em uma especificação de design concreta. Elimina a ambiguidade de solicitações vagas como 'torne profissional' ao exigir dimensões explícitas: paleta, tipografia, layout, atmosfera, densidade e restrições.\nPalavras-chave de ativação: design brief, create a design brief, ilang brief, structured brief.",
    "it": "Analizza un brief di design strutturato nel formato del protocollo I-Lang in una specifica di design concreta. Elimina l'ambiguità da richieste vaghe come 'rendilo professionale' richiedendo dimensioni esplicite: palette, tipografia, layout, atmosfera, densità e vincoli.\nParole chiave di attivazione: design brief, create a design brief, ilang brief, structured brief.",
    "vi": "Phân tích bản tóm tắt thiết kế có cấu trúc được viết theo định dạng giao thức I-Lang thành đặc tả thiết kế cụ thể. Loại bỏ sự mơ hồ từ các yêu cầu mơ hồ như 'làm cho nó chuyên nghiệp' bằng cách yêu cầu các thông số rõ ràng: bảng màu, typography, bố cục, tâm trạng, mật độ và ràng buộc.\nTừ khóa kích hoạt: design brief, create a design brief, ilang brief, structured brief.",
    "pl": "Parsuje ustrukturyzowany brief projektowy w formacie protokołu I-Lang na konkretną specyfikację projektu. Eliminuje niejednoznaczność z niejasnych próśb takich jak 'zrób to profesjonalnie', wymagając jawnych wymiarów: paleta, typografia, układ, nastrój, gęstość i ograniczenia.\nSłowa kluczowe aktywacji: design brief, create a design brief, ilang brief, structured brief.",
    "id": "Mengurai brief desain terstruktur yang ditulis dalam format protokol I-Lang menjadi spesifikasi desain konkret. Menghilangkan ambiguitas dari permintaan yang samar seperti 'buat profesional' dengan memerlukan dimensi eksplisit: palet, tipografi, tata letak, suasana, kepadatan, dan batasan.\nKata kunci pemicu: design brief, create a design brief, ilang brief, structured brief.",
    "nl": "Parseert een gestructureerde ontwerpbrief in I-Lang-protocolformaat naar een concrete ontwerpspecificatie. Elimineert dubbelzinnigheid uit vage verzoeken zoals 'maak het professioneel' door expliciete dimensies te vereisen: palet, typografie, lay-out, sfeer, dichtheid en beperkingen.\nTriggerwoorden: design brief, create a design brief, ilang brief, structured brief.",
    "ar": "يحلل موجز تصميم منظم مكتوب بتنسيق بروتوكول I-Lang إلى مواصفات تصميم محددة. يزيل الغموض من الطلبات المبهمة مثل 'اجعله احترافيًا' من خلال طلب أبعاد صريحة: لوحة الألوان، الطباعة، التخطيط، الحالة المزاجية، الكثافة والقيود.\nالكلمات المفتاحية: design brief، create a design brief، ilang brief، structured brief.",
    "tr": "I-Lang protokol formatında yazılmış yapılandırılmış bir tasarım brifini somut bir tasarım spesifikasyonuna dönüştürür. Palet, tipografi, düzen, ruh hali, yoğunluk ve kısıtlamalar gibi açık boyutlar gerektirerek 'profesyonel yap' gibi belirsiz isteklerdeki belirsizliği ortadan kaldırır.\nTetikleyici anahtar kelimeler: design brief, create a design brief, ilang brief, structured brief.",
    "uk": "Парсить структурований дизайн-бриф у форматі протоколу I-Lang у конкретну дизайн-специфікацію. Усуває неоднозначність розпливчастих запитів на кшталт 'зроби професійно', вимагаючи явних параметрів: палітра, типографіка, макет, настрій, щільність та обмеження.\nКлючові слова: design brief, create a design brief, ilang brief, structured brief.",
    "en": "Parse a structured design brief written in I-Lang protocol format into a\nconcrete design spec. Eliminates ambiguity from vague requests like\n\"make it professional\" by requiring explicit dimensions: palette, typography,\nlayout, mood, density, and constraints.\nTrigger keywords: \"design brief\", \"create a design brief\", \"ilang brief\", \"structured brief\"."
  },
  "license": "MIT",
  "author": {
    "name": "Readable Studio",
    "url": "https://github.com/sanghyunna/readable-studio"
  },
  "homepage": "https://github.com/sanghyunna/readable-studio/tree/main/plugins/_official/examples/design-brief",
  "tags": [
    "example",
    "first-party",
    "design-system",
    "planning",
    "web",
    "desktop",
    "design-brief",
    "create-a-design-brief",
    "ilang-brief",
    "structured-brief"
  ],
  "compat": {
    "agentSkills": [
      {
        "path": "./SKILL.md"
      }
    ]
  },
  "readable": {
    "hubType": "none",
    "kind": "scenario",
    "taskKind": "new-generation",
    "mode": "design-system",
    "platform": "desktop",
    "scenario": "planning",
    "surface": "web",
    "preview": {
      "type": "html",
      "entry": "./brief-preview.html"
    },
    "useCase": {
      "query": {
        "en": "Parse a structured design brief written in I-Lang protocol format into a concrete design spec. Eliminates ambiguity from vague requests like \"make it professional\" by requiring explicit dimensions: palette, typography, layout, mood, density, and constraints. Trigger keywords: \"design brief\", \"create a design brief\", \"i",
        "zh-CN": "使用这个插件完成以下任务：Parse a structured design brief written in I-Lang protocol format into a concrete design spec. Eliminates ambiguity from vague requests like \"make it professional\" by requiring explicit dimensions: palette, typography, layout, mood, density, and constraints. Trigger keywords: \"design brief\", \"create a design brief\", \"i"
      }
    },
    "inputs": [
      {
        "name": "brief",
        "type": "string",
        "required": true,
        "description": "I-Lang formatted design brief or natural language description"
      }
    ],
    "context": {
      "skills": [
        {
          "path": "./SKILL.md"
        }
      ],
      "assets": []
    },
    "pipeline": {
      "stages": [
        {
          "id": "generate",
          "atoms": [
            "file-write"
          ]
        }
      ]
    },
    "capabilities": [
      "prompt:inject",
      "fs:write"
    ]
  }
}
