{
  "$schema": "urn:readable-studio:schema:plugin-manifest:v1",
  "specVersion": "1.0.0",
  "name": "example-web-prototype-taste-brutalist",
  "title": "Brutalist Web Prototype",
  "title_i18n": {
    "zh-CN": "Brutalist Web Prototype",
    "zh-TW": "Brutalist Web Prototype",
    "ja": "Brutalist Web Prototype",
    "ko": "브루탈리스트 웹 프로토타입",
    "de": "Brutalist Web Prototype",
    "fr": "Brutalist Web Prototype",
    "ru": "Brutalist Web Prototype",
    "es": "Brutalist Web Prototype",
    "pt-BR": "Brutalist Web Prototype",
    "it": "Brutalist Web Prototype",
    "vi": "Brutalist Web Prototype",
    "pl": "Brutalist Web Prototype",
    "id": "Brutalist Web Prototype",
    "nl": "Brutalist Web Prototype",
    "ar": "Brutalist Web Prototype",
    "tr": "Brutalist Web Prototype",
    "uk": "Brutalist Web Prototype",
    "en": "Brutalist Web Prototype"
  },
  "version": "0.1.0",
  "description": "Swiss industrial-print web prototype. Newsprint canvas, monolithic black grotesque, viewport-bleeding numerals, hairline grid dividers, hazard-red accent, ASCII syntax decoration. Distilled from Leonxlnx/taste-skill `brutalist-skill` (Swiss Industrial Print mode).",
  "description_i18n": {
    "zh-CN": "瑞士工业印刷风格网页原型。新闻纸画布、黑色粗体字、溢出式数字、细线网格分隔、危险红强调色、ASCII 语法装饰。源自 Leonxlnx/taste-skill `brutalist-skill`（瑞士工业印刷模式）。",
    "zh-TW": "瑞士工業印刷風格網頁原型。新聞紙畫布、黑色粗體字、溢出式數字、細線網格分隔、危險紅強調色、ASCII 語法裝飾。源自 Leonxlnx/taste-skill `brutalist-skill`（瑞士工業印刷模式）。",
    "ja": "スイス産業印刷スタイルのウェブプロトタイプ。新聞紙キャンバス、モノリシックな黒のグロテスク書体、ビューポートから溢れる数字、ヘアライングリッド分割、ハザードレッドアクセント、ASCII シンタックス装飾。Leonxlnx/taste-skill `brutalist-skill`（スイス産業印刷モード）より抽出。",
    "ko": "스위스 산업 인쇄 스타일 웹 프로토타입. 신문지 캔버스, 모놀리식 블랙 그로테스크 서체, 뷰포트 넘침 숫자, 헤어라인 그리드 구분선, 위험 빨강 강조, ASCII 구문 장식. Leonxlnx/taste-skill `brutalist-skill`(스위스 산업 인쇄 모드)에서 추출.",
    "de": "Web-Prototyp im Schweizer Industriedruck-Stil. Zeitungspapier-Canvas, monolithische schwarze Grotesk-Schrift, viewport-übergreifende Ziffern, haardünne Rastereinteilungen, gefahrenrote Akzente, ASCII-Syntax-Dekoration. Abgeleitet von Leonxlnx/taste-skill `brutalist-skill` (Schweizer Industriedruck-Modus).",
    "fr": "Prototype web d'imprimerie industrielle suisse. Toile papier journal, grotesque noire monolithique, chiffres débordant du viewport, séparateurs de grille ultrafins, accent rouge danger, décoration syntaxe ASCII. Extrait de Leonxlnx/taste-skill `brutalist-skill` (mode imprimerie industrielle suisse).",
    "ru": "Веб-прототип в стиле швейцарской промышленной печати. Газетный холст, монолитный чёрный гротеск, выходящие за пределы вьюпорта цифры, тонкие разделители сетки, опасно-красный акцент, ASCII-декор синтаксиса. Создан на основе Leonxlnx/taste-skill `brutalist-skill` (режим швейцарской промышленной печати).",
    "es": "Prototipo web de impresión industrial suiza. Lienzo de papel periódico, grotesca negra monolítica, números que desbordan el viewport, divisores de cuadrícula ultrafinos, acento rojo peligro, decoración de sintaxis ASCII. Destilado de Leonxlnx/taste-skill `brutalist-skill` (modo impresión industrial suiza).",
    "pt-BR": "Protótipo web de impressão industrial suíça. Tela papel jornal, grotesca preta monolítica, numerais sangrados no viewport, divisores de grade finos, destaque vermelho perigo, decoração sintaxe ASCII. Destilado de Leonxlnx/taste-skill `brutalist-skill` (modo impressão industrial suíça).",
    "it": "Prototipo web stampa industriale svizzera. Canvas carta da giornale, grottesco nero monolitico, numeri che sanguinano dal viewport, divisori griglia sottilissimi, accento rosso pericolo, decorazione sintassi ASCII. Estratto da Leonxlnx/taste-skill `brutalist-skill` (modalità stampa industriale svizzera).",
    "vi": "Nguyên mẫu web phong cách in công nghiệp Thụy Sĩ. Canvas giấy báo, chữ grotesque đen nguyên khối, số tràn khung viewport, đường phân cách lưới siêu mỏng, điểm nhấn đỏ nguy hiểm, trang trí cú pháp ASCII. Trích xuất từ Leonxlnx/taste-skill `brutalist-skill` (chế độ in công nghiệp Thụy Sĩ).",
    "pl": "Prototyp webowy w stylu szwajcarskiego druku przemysłowego. Płótno papieru gazetowego, monolityczny czarny grotesk, cyfry wykraczające poza viewport, włoskowate podziały siatki, akcent w kolorze czerwieni ostrzegawczej, dekoracja składni ASCII. Destylowane z Leonxlnx/taste-skill `brutalist-skill` (tryb szwajcarskiego druku przemysłowego).",
    "id": "Prototipe web cetak industri Swiss. Kanvas kertas koran, grotesque hitam monolitik, angka yang meluap viewport, pembagi grid tipis, aksen merah bahaya, dekorasi sintaks ASCII. Disuling dari Leonxlnx/taste-skill `brutalist-skill` (mode cetak industri Swiss).",
    "nl": "Webprototype in Zwitserse industriële drukkenstijl. Krantenpapierdoek, monolithisch zwart groteskschrift, viewport-overlopende cijfers, haardunne rasterscheidingen, gevarenrood accent, ASCII-syntaxdecoratie. Gedistilleerd uit Leonxlnx/taste-skill `brutalist-skill` (Zwitserse industriële drukmodus).",
    "ar": "نموذج ويب بأسلوب الطباعة الصناعية السويسرية. لوحة ورق صحف، خط جروتسك أسود أحادي، أرقام تتجاوز إطار العرض، فواصل شبكة رفيعة، لهجة حمراء تحذيرية، زخرفة بناء جملة ASCII. مستخلص من Leonxlnx/taste-skill `brutalist-skill` (وضع الطباعة الصناعية السويسرية).",
    "tr": "İsviçre endüstriyel baskı tarzı web prototipi. Gazete kağıdı tuval, monolitik siyah grotesk yazı, viewport'tan taşan rakamlar, ince çizgi ızgara ayırıcılar, tehlike kırmızısı vurgu, ASCII sözdizimi dekorasyonu. Leonxlnx/taste-skill `brutalist-skill`'den damıtılmıştır (İsviçre endüstriyel baskı modu).",
    "uk": "Веб-прототип у стилі швейцарського промислового друку. Газетне полотно, монолітний чорний гротеск, цифри що виходять за межі viewport, тонкі роздільники сітки, небезпечно-червоний акцент, ASCII-декор синтаксису. Створено на основі Leonxlnx/taste-skill `brutalist-skill` (режим швейцарського промислового друку).",
    "en": "Swiss industrial-print web prototype. Newsprint canvas, monolithic black grotesque, viewport-bleeding numerals, hairline grid dividers, hazard-red accent, ASCII syntax decoration. Distilled from Leonxlnx/taste-skill `brutalist-skill` (Swiss Industrial Print mode)."
  },
  "license": "MIT",
  "author": {
    "name": "Readable Studio",
    "url": "https://github.com/sanghyunna/readable-studio"
  },
  "homepage": "https://github.com/sanghyunna/readable-studio/tree/main/plugins/_official/examples/web-prototype-taste-brutalist",
  "tags": [
    "example",
    "first-party",
    "prototype",
    "design",
    "web"
  ],
  "compat": {
    "agentSkills": [
      {
        "path": "./SKILL.md"
      }
    ]
  },
  "readable": {
    "kind": "scenario",
    "taskKind": "new-generation",
    "mode": "prototype",
    "scenario": "design",
    "surface": "web",
    "preview": {
      "type": "html",
      "entry": "./example.html"
    },
    "useCase": {
      "query": {
        "en": "Swiss industrial-print web prototype. Newsprint canvas, monolithic black grotesque, viewport-bleeding numerals, hairline grid dividers, hazard-red accent, ASCII syntax decoration. Distilled from Leonxlnx/taste-skill `brutalist-skill` (Swiss Industrial Print mode).",
        "zh-CN": "使用这个插件完成以下任务：Swiss industrial-print web prototype. Newsprint canvas, monolithic black grotesque, viewport-bleeding numerals, hairline grid dividers, hazard-red accent, ASCII syntax decoration. Distilled from Leonxlnx/taste-skill `brutalist-skill` (Swiss Industrial Print mode)."
      },
      "exampleOutputs": [
        {
          "path": "./example.html",
          "title": "Web Prototype Taste Brutalist"
        }
      ]
    },
    "context": {
      "skills": [
        {
          "path": "./SKILL.md"
        }
      ],
      "designSystem": {
        "primary": true
      },
      "assets": [
        "./example.html"
      ]
    },
    "pipeline": {
      "stages": [
        {
          "id": "generate",
          "atoms": [
            "file-write"
          ]
        }
      ]
    },
    "capabilities": [
      "prompt:inject",
      "fs:write"
    ],
    "featured": 0.1
  }
}
